<?xml version="1.0" encoding="UTF-8"?>
<in:Interesovanje xmlns:in="http:///www.ftn.uns.ac.rs/vakcinacija/interesovanje"
    xmlns:ct="http:///www.ftn.uns.ac.rs/vakcinacija/commonTypes"  xmlns:xsi="http://www.w3.org/2001/XMLSchema-instance" 
    xsi:schemaLocation="http:///www.ftn.uns.ac.rs/vakcinacija/interesovanje interesovanje.xsd">
    <in:DrzavljaninOpcija>Drzаvljаnin Republike Srbije</in:DrzavljaninOpcija>
    <in:licneInformacije>
        <in:JMBG>3553355353533</in:JMBG>
        <in:PunoIme>
            <ct:Ime>Daniel</ct:Ime>
            <ct:Prezime>Bozanic</ct:Prezime>
        </in:PunoIme>
        <in:AdresaElektronskePoste>test@gmail.com</in:AdresaElektronskePoste>
        <in:BrojMobilnogTelefona>0635678901</in:BrojMobilnogTelefona>
        <in:BrojFiksnogTelefona>011518556</in:BrojFiksnogTelefona>
        <in:Opstina>Sabac</in:Opstina>
    </in:licneInformacije>
    <in:VakcinaOpcija>Pfizer-BioNTech</in:VakcinaOpcija>
    <in:DavalacKrviOpcija>Nе</in:DavalacKrviOpcija>
</in:Interesovanje>